{
  "schema_version": "1.0",
  "message_id": "MSG-REVIEW-0001",
  "run_id": "RUN-EXAMPLE",
  "round_id": "ROUND-001",
  "ticket_id": "TICKET-001",
  "role": "reviewer",
  "status": "success",
  "summary": "Acceptance criteria and security checks passed.",
  "artifacts": [{ "path": "harness/examples/reviewer.output.json", "kind": "review", "sha256": "0000000000000000000000000000000000000000000000000000000000000000" }],
  "errors": [],
  "created_at": "2026-08-19T00:00:00.000Z",
  "payload": {
    "ticket_id": "TICKET-001",
    "verdict": "approved",
    "criteria": [{ "criterion": "All verified sections render responsively", "status": "met", "evidence": "Source and production build evidence" }],
    "security_checks": ["No secrets or unsafe dynamic HTML introduced"],
    "findings": [],
    "residual_risk": "low"
  }
}
