{
  "schema_version": "1.0",
  "message_id": "MSG-CODE-0001",
  "run_id": "RUN-EXAMPLE",
  "round_id": "ROUND-001",
  "ticket_id": "TICKET-001",
  "role": "coder",
  "status": "success",
  "summary": "Ticket implemented and checks passed.",
  "artifacts": [{ "path": "app/page.tsx", "kind": "code", "sha256": "0000000000000000000000000000000000000000000000000000000000000000" }],
  "errors": [],
  "created_at": "2026-08-19T00:00:00.000Z",
  "payload": {
    "ticket_id": "TICKET-001",
    "criteria_coverage": [{ "criterion": "All approved sections render responsively", "evidence": "Responsive page and build test" }],
    "changes": ["Implemented the portfolio page"],
    "checks": [{ "name": "production build", "command": "pnpm run build", "result": "passed" }],
    "known_limitations": ["Contact links require owner configuration"],
    "scope_change_request": null
  }
}
